{
  "case_id": "C14",
  "family_id": "powershell-approved-inventory-v1",
  "split": "dev",
  "ground_truth": "benign",
  "complete_world_evidence": {
    "E0": {
      "source": "alert",
      "record_ids": [
        "13e753f53bdd88d3403223ab87fb2458"
      ],
      "observation": "PowerShell detector fired; detector text is not verified behavior."
    },
    "E1": {
      "source": "siem",
      "record_ids": [
        "1a10bb7c580ac76cd162de35cc7542e7"
      ],
      "observation": {
        "view": "process_tree",
        "host": "OPS-114",
        "user": "svc-inventory",
        "process_id": "p-1414",
        "process_guid": "4e0f94ae28d4e55a1e430428abd53e8f",
        "event_id": "60665e65c1952273b77cd72056347385",
        "occurred_at": "2026-09-01T02:14:00+00:00",
        "observed_at": "2026-09-01T02:19:00+00:00",
        "parent_process": "inventory-agent.exe",
        "child_process": [],
        "job_id": "INV-14",
        "script_hash": "h-inventory-14",
        "parameters": [
          "inventory",
          "publish"
        ],
        "script_observations": [
          {
            "operation": "read",
            "object": "software-inventory",
            "authorized": true
          },
          {
            "operation": "write",
            "object": "inventory-report",
            "authorized": true
          }
        ]
      }
    },
    "E2": {
      "source": "siem",
      "record_ids": [
        "f8b04f87b6d5ca441a13e3fee0384259",
        "2a74fa09e56ce847e8046cebfb4a7879"
      ],
      "observation": {
        "view": "network_events",
        "host": "OPS-114",
        "user": "svc-inventory",
        "process_id": "p-1414",
        "process_guid": "4e0f94ae28d4e55a1e430428abd53e8f",
        "event_id": "15a3a863b79671016e4a6c0bd22f48f2",
        "occurred_at": "2026-09-01T02:14:00+00:00",
        "observed_at": "2026-09-01T02:19:00+00:00",
        "observed_destinations": [
          "10.40.0.14"
        ],
        "all_connections_captured": true,
        "destination_ip": "10.40.0.14",
        "destination_port": 443
      }
    },
    "E3": {
      "source": "asset",
      "record_ids": [
        "b017d3313e061aed775085abbccb02e1"
      ],
      "observation": {
        "host": "OPS-114",
        "published_at": "2026-09-01T02:19:00+00:00",
        "purpose": "managed-workstation",
        "system_type": "Windows",
        "critical_asset": false,
        "department": "synthetic-enterprise",
        "approval_register_complete": true,
        "approval_register_window": {
          "start": "2026-09-01T02:10:00+00:00",
          "end": "2026-09-01T02:20:00+00:00"
        },
        "approved_jobs": [
          {
            "host": "OPS-114",
            "user": "svc-inventory",
            "job_id": "INV-14",
            "script_hash": "h-inventory-14",
            "parameters": [
              "inventory",
              "publish"
            ],
            "window": {
              "start": "2026-09-01T02:00:00+00:00",
              "end": "2026-09-01T03:00:00+00:00"
            },
            "allowed_destinations": [
              "10.40.0.14"
            ],
            "expected_observations": [
              {
                "operation": "read",
                "object": "software-inventory",
                "authorized": true
              },
              {
                "operation": "write",
                "object": "inventory-report",
                "authorized": true
              }
            ]
          }
        ]
      }
    },
    "E5": {
      "source": "attack",
      "record_ids": [
        "aef5379e980cb7c9d45ea7f1d737607e"
      ],
      "observation": {
        "snapshot_version": "attack-local-v1",
        "published_at": "2026-08-01T00:00:00+00:00",
        "technique_id": "T1059.001",
        "behavior_terms": [
          "powershell_execution"
        ],
        "description": "PowerShell occurs in authorized and unauthorized activity; mapping is not a verdict."
      }
    }
  },
  "observable_fact_keys": [
    "E0",
    "E1",
    "E2",
    "E3",
    "E5"
  ],
  "critical_fact_keys": [
    "E1",
    "E2",
    "E3"
  ],
  "distractor_fact_keys": [
    "E5"
  ],
  "sufficient_sets": {
    "TP": [],
    "FP": [
      [
        "E1",
        "E2",
        "E3"
      ]
    ]
  },
  "acceptable_verdicts": [
    "FP"
  ],
  "resolvable_with_full_observable_evidence": true,
  "expected_actions": [
    {
      "when_observed_fact_keys": [
        "E0"
      ],
      "when_missing_fact_keys": [
        "E1"
      ],
      "acceptable_tools": [
        "siem"
      ],
      "argument_constraints": {
        "view": "process_tree",
        "host": "OPS-114",
        "process_id": "p-1414"
      },
      "evidence_goal": "Inspect grounded current process behavior."
    },
    {
      "when_observed_fact_keys": [
        "E0"
      ],
      "when_missing_fact_keys": [
        "E2"
      ],
      "acceptable_tools": [
        "siem"
      ],
      "argument_constraints": {
        "view": "network_events",
        "host": "OPS-114",
        "process_id": "p-1414"
      },
      "evidence_goal": "Inspect same-instance network effects and coverage."
    },
    {
      "when_observed_fact_keys": [
        "E0"
      ],
      "when_missing_fact_keys": [
        "E3"
      ],
      "acceptable_tools": [
        "asset"
      ],
      "argument_constraints": {
        "host": "OPS-114"
      },
      "evidence_goal": "Check execution details against complete approvals."
    }
  ],
  "rubric_version": "powershell-v1",
  "annotation_rationale": "Duplicate same-source network records do not add support; the deduplicated activity matches approval."
}
