{
  "case_id": "C3",
  "family_id": "powershell-seed-v1",
  "split": "dev",
  "ground_truth": "malicious",
  "complete_world_evidence": {
    "E0": {
      "source": "alert",
      "record_ids": [
        "df421f5ffb341a76e1dcf23b6165b5b0"
      ],
      "observation": "PowerShell detector fired; detector claim is not verified behavior"
    },
    "E1": {
      "source": "asset",
      "record_ids": [
        "a9304d07b0b460b36b8daf58a492e308"
      ],
      "observation": {
        "host": "OPS-023",
        "published_at": "2026-09-01T02:19:00+00:00",
        "purpose": "operations",
        "system_type": "Windows",
        "critical_asset": false,
        "department": "synthetic-operations",
        "approval_register_complete": true,
        "approval_register_window": {
          "start": "2026-09-01T02:10:00+00:00",
          "end": "2026-09-01T02:20:00+00:00"
        },
        "approved_jobs": [
          {
            "host": "OPS-023",
            "user": "svc-maint",
            "job_id": "J-7",
            "script_hash": "h-7",
            "parameters": [
              "backup"
            ],
            "window": {
              "start": "2026-09-01T02:00:00+00:00",
              "end": "2026-09-01T03:00:00+00:00"
            }
          }
        ]
      }
    },
    "E2": {
      "source": "siem",
      "record_ids": [
        "b2e2469adf2e6a7bcaa1c832cab8a4da",
        "a57159a7f0065ca3c802fcdd0dc49b7d",
        "1732279bcc01f325b94633c6865ad23b"
      ],
      "observation": {
        "view": "process_tree",
        "host": "OPS-023",
        "user": "svc-maint",
        "process_id": "p-303",
        "process_guid": "eb41aff44f241f65a1869850ccdf1fba",
        "event_id": "c3b004135fb556d8e51f036a29bb6456",
        "occurred_at": "2026-09-01T02:14:00+00:00",
        "observed_at": "2026-09-01T02:19:00+00:00",
        "parent_process": "management-task.exe",
        "job_id": "J-9",
        "script_hash": "h-9",
        "parameters": [
          "export",
          "external"
        ],
        "script_body": null
      }
    },
    "E3": {
      "source": "siem",
      "record_ids": [
        "3cb36b5b5dce63d8787eed3cd079b3a7",
        "8ccbfacdfe9f330e544dcfc38cb74130",
        "7ef48754c6c6274c5b7286db40fed9ba"
      ],
      "observation": {
        "view": "network_events",
        "host": "OPS-023",
        "user": "svc-maint",
        "process_id": "p-303",
        "process_guid": "eb41aff44f241f65a1869850ccdf1fba",
        "event_id": "f0e9c9d1d5806174bc76e043354005e7",
        "occurred_at": "2026-09-01T02:14:00+00:00",
        "observed_at": "2026-09-01T02:19:00+00:00",
        "destination_ip": "198.51.100.27",
        "destination_port": 443,
        "new_destination": true,
        "payload_captured": false
      }
    },
    "E4": {
      "source": "threat_intel",
      "record_ids": [
        "85c5a97d22d9b3def7d9480253bec8dc",
        "0c1932eed5d8cfdf3e70891b04a8cc60"
      ],
      "observation": {
        "indicator_type": "ip",
        "value": "198.51.100.27",
        "published_at": "2026-09-01T02:19:00+00:00",
        "reputation": "unknown",
        "provider": "local-mock",
        "not_a_real_ioc_assessment": true
      }
    },
    "E5": {
      "source": "history",
      "record_ids": [],
      "operational_status": "unavailable",
      "reason": "history_retention_unavailable"
    },
    "E6": {
      "source": "oracle_only",
      "record_ids": [],
      "script_body": "Synthetic hidden credential theft and transmission"
    },
    "E7": {
      "source": "attack",
      "record_ids": [
        "7b31ddd1121f97a91b239277c95ec469"
      ],
      "observation": {
        "snapshot_version": "attack-local-v1",
        "published_at": "2026-08-01T00:00:00+00:00",
        "technique_id": "T1059.001",
        "behavior_terms": [
          "PowerShell"
        ],
        "description": "PowerShell execution can occur in authorized and unauthorized activity; mapping is not an attack verdict."
      }
    }
  },
  "observable_fact_keys": [
    "E0",
    "E1",
    "E2",
    "E3",
    "E4",
    "E5",
    "E7"
  ],
  "critical_fact_keys": [
    "E1",
    "E2",
    "E3",
    "E6"
  ],
  "distractor_fact_keys": [
    "E7"
  ],
  "sufficient_sets": {
    "TP": [],
    "FP": []
  },
  "acceptable_verdicts": [
    "Suspicious",
    "Abstain"
  ],
  "resolvable_with_full_observable_evidence": false,
  "expected_actions": [
    {
      "when_observed_fact_keys": [
        "E0"
      ],
      "when_missing_fact_keys": [
        "E2"
      ],
      "acceptable_tools": [
        "siem"
      ],
      "argument_constraints": {
        "view": "process_tree",
        "host": "OPS-023",
        "process_id": "p-303"
      },
      "evidence_goal": "Check actual process behavior or related network behavior and coverage"
    },
    {
      "when_observed_fact_keys": [
        "E0"
      ],
      "when_missing_fact_keys": [
        "E3"
      ],
      "acceptable_tools": [
        "siem"
      ],
      "argument_constraints": {
        "view": "network_events",
        "host": "OPS-023",
        "process_id": "p-303"
      },
      "evidence_goal": "Check actual process behavior or related network behavior and coverage"
    },
    {
      "when_observed_fact_keys": [
        "E0"
      ],
      "when_missing_fact_keys": [
        "E1"
      ],
      "acceptable_tools": [
        "asset"
      ],
      "argument_constraints": {
        "host": "OPS-023"
      },
      "evidence_goal": "Check matched authorization; an approval window alone is insufficient"
    }
  ],
  "rubric_version": "powershell-v1",
  "annotation_rationale": "Independent synthetic annotation from minimal-cases.md; only observed, grounded evidence supports decisions. Hidden world truth is not an agent hint."
}
