{
  "case_id": "C18",
  "family_id": "powershell-approval-conflict-pair-v1",
  "split": "dev",
  "ground_truth": "benign",
  "complete_world_evidence": {
    "E0": {
      "source": "alert",
      "record_ids": [
        "700ca78a605c43e2bd6aa701a892ad87"
      ],
      "observation": "PowerShell detector fired; detector text is not verified behavior."
    },
    "E1": {
      "source": "siem",
      "record_ids": [
        "e5b540d4bb044760aa5432773aa2462f"
      ],
      "observation": {
        "view": "process_tree",
        "host": "WS-117",
        "user": "contractor-h",
        "process_id": "p-1718",
        "process_guid": "7d6512ee4a0087801df1232805992abc",
        "event_id": "99a179f51dfebdfd2b2debf8959eabb3",
        "occurred_at": "2026-09-01T02:14:00+00:00",
        "observed_at": "2026-09-01T02:19:00+00:00",
        "parent_process": "signed-helper.exe",
        "child_process": [],
        "job_id": "DIAG-17",
        "script_hash": "h-diagnostic-17",
        "parameters": [
          "diagnose",
          "publish"
        ],
        "script_observations": [
          {
            "operation": "read",
            "object": "diagnostic-settings",
            "authorized": true
          },
          {
            "operation": "write",
            "object": "diagnostic-report",
            "authorized": true
          }
        ]
      }
    },
    "E2": {
      "source": "siem",
      "record_ids": [
        "3594d8c1dbef7ac8ca3853cbc7feeae1"
      ],
      "observation": {
        "view": "network_events",
        "host": "WS-117",
        "user": "contractor-h",
        "process_id": "p-1718",
        "process_guid": "7d6512ee4a0087801df1232805992abc",
        "event_id": "2bbeed1fd6f15cffc1315a59d3d44987",
        "occurred_at": "2026-09-01T02:14:00+00:00",
        "observed_at": "2026-09-01T02:19:00+00:00",
        "observed_destinations": [
          "10.42.0.17"
        ],
        "all_connections_captured": true,
        "destination_ip": "10.42.0.17",
        "destination_port": 443
      }
    },
    "E3": {
      "source": "asset",
      "record_ids": [
        "65ba4700202cf9befa709afaf58985b2",
        "7b751428020464360b5d8cd8a7eb2372"
      ],
      "observation": {
        "host": "WS-117",
        "published_at": "2026-09-01T02:19:00+00:00",
        "purpose": "managed-workstation",
        "system_type": "Windows",
        "critical_asset": false,
        "department": "synthetic-enterprise",
        "approval_register_complete": true,
        "approval_register_window": {
          "start": "2026-09-01T02:10:00+00:00",
          "end": "2026-09-01T02:20:00+00:00"
        },
        "approved_jobs": [
          {
            "host": "WS-117",
            "user": "contractor-h",
            "job_id": "DIAG-17",
            "script_hash": "h-diagnostic-17",
            "parameters": [
              "diagnose",
              "publish"
            ],
            "window": {
              "start": "2026-09-01T02:00:00+00:00",
              "end": "2026-09-01T03:00:00+00:00"
            },
            "allowed_destinations": [
              "10.42.0.17"
            ],
            "expected_observations": [
              {
                "operation": "read",
                "object": "diagnostic-settings",
                "authorized": true
              },
              {
                "operation": "write",
                "object": "diagnostic-report",
                "authorized": true
              }
            ]
          }
        ]
      }
    },
    "E4": {
      "source": "history",
      "record_ids": [
        "429b90788a2ca08ced95d6754d51b1b2"
      ],
      "observation": {
        "entity_type": "user",
        "entity": "contractor-h",
        "host": "WS-117",
        "user": "contractor-h",
        "occurred_at": "2026-08-31T12:00:00+00:00",
        "observed_at": "2026-09-01T02:19:00+00:00",
        "approval_feed_conflict": true,
        "comparable_history_complete": true
      }
    },
    "E5": {
      "source": "attack",
      "record_ids": [
        "a099649161be8ef572ade4df06a4bad9"
      ],
      "observation": {
        "snapshot_version": "attack-local-v1",
        "published_at": "2026-08-01T00:00:00+00:00",
        "technique_id": "T1059.001",
        "behavior_terms": [
          "powershell_execution"
        ],
        "description": "PowerShell occurs in authorized and unauthorized activity; mapping is not a verdict."
      }
    },
    "E6": {
      "source": "oracle_only",
      "record_ids": [],
      "script_intent": "approved diagnostics"
    }
  },
  "observable_fact_keys": [
    "E0",
    "E1",
    "E2",
    "E3",
    "E4",
    "E5"
  ],
  "critical_fact_keys": [
    "E3",
    "E6"
  ],
  "distractor_fact_keys": [
    "E5"
  ],
  "sufficient_sets": {
    "TP": [],
    "FP": []
  },
  "acceptable_verdicts": [
    "Abstain"
  ],
  "resolvable_with_full_observable_evidence": false,
  "expected_actions": [
    {
      "when_observed_fact_keys": [
        "E0"
      ],
      "when_missing_fact_keys": [
        "E1"
      ],
      "acceptable_tools": [
        "siem"
      ],
      "argument_constraints": {
        "view": "process_tree",
        "host": "WS-117",
        "process_id": "p-1718"
      },
      "evidence_goal": "Inspect grounded current process behavior."
    },
    {
      "when_observed_fact_keys": [
        "E0"
      ],
      "when_missing_fact_keys": [
        "E2"
      ],
      "acceptable_tools": [
        "siem"
      ],
      "argument_constraints": {
        "view": "network_events",
        "host": "WS-117",
        "process_id": "p-1718"
      },
      "evidence_goal": "Inspect same-instance network effects and coverage."
    },
    {
      "when_observed_fact_keys": [
        "E0"
      ],
      "when_missing_fact_keys": [
        "E3"
      ],
      "acceptable_tools": [
        "asset"
      ],
      "argument_constraints": {
        "host": "WS-117"
      },
      "evidence_goal": "Check execution details against complete approvals."
    },
    {
      "when_observed_fact_keys": [
        "E0"
      ],
      "when_missing_fact_keys": [
        "E4"
      ],
      "acceptable_tools": [
        "history"
      ],
      "argument_constraints": {
        "entity_type": "user",
        "entity": "contractor-h"
      },
      "evidence_goal": "Check comparable user history."
    }
  ],
  "rubric_version": "powershell-v1",
  "annotation_rationale": "Independent approval sources conflict, so identical visible evidence cannot resolve intent."
}
