{
  "case_id": "C7",
  "family_id": "powershell-office-approved-v1",
  "split": "dev",
  "ground_truth": "benign",
  "complete_world_evidence": {
    "E0": {
      "source": "alert",
      "record_ids": [
        "a7d7f8635f0c4743b031396b3dde0e77"
      ],
      "observation": "PowerShell detector fired; detector text is not verified behavior."
    },
    "E1": {
      "source": "siem",
      "record_ids": [
        "285881af1bac19c1668e4fa6c852e4ac"
      ],
      "observation": {
        "view": "process_tree",
        "host": "WS-107",
        "user": "finance-a",
        "process_id": "p-707",
        "process_guid": "77d4054c517c75d2b7a552bac7221b85",
        "event_id": "b8b3da8894e8e438ce0c0d6268d5f021",
        "occurred_at": "2026-09-01T02:14:00+00:00",
        "observed_at": "2026-09-01T02:19:00+00:00",
        "parent_process": "EXCEL.EXE",
        "child_process": [],
        "job_id": "REPORT-7",
        "script_hash": "h-report-7",
        "parameters": [
          "report",
          "monthly"
        ],
        "script_observations": [
          {
            "operation": "read",
            "object": "approved-spreadsheet",
            "authorized": true
          },
          {
            "operation": "write",
            "object": "approved-report",
            "authorized": true
          }
        ]
      }
    },
    "E2": {
      "source": "siem",
      "record_ids": [
        "7155b2fb88c7b08911309312683aafe7"
      ],
      "observation": {
        "view": "network_events",
        "host": "WS-107",
        "user": "finance-a",
        "process_id": "p-707",
        "process_guid": "77d4054c517c75d2b7a552bac7221b85",
        "event_id": "d14aef5f916469cea1bdcc87e2197266",
        "occurred_at": "2026-09-01T02:14:00+00:00",
        "observed_at": "2026-09-01T02:19:00+00:00",
        "observed_destinations": [],
        "all_connections_captured": true
      }
    },
    "E3": {
      "source": "asset",
      "record_ids": [
        "862f785532889694ff10478d9c146f59"
      ],
      "observation": {
        "host": "WS-107",
        "published_at": "2026-09-01T02:19:00+00:00",
        "purpose": "managed-workstation",
        "system_type": "Windows",
        "critical_asset": false,
        "department": "synthetic-enterprise",
        "approval_register_complete": true,
        "approval_register_window": {
          "start": "2026-09-01T02:10:00+00:00",
          "end": "2026-09-01T02:20:00+00:00"
        },
        "approved_jobs": [
          {
            "host": "WS-107",
            "user": "finance-a",
            "job_id": "REPORT-7",
            "script_hash": "h-report-7",
            "parameters": [
              "report",
              "monthly"
            ],
            "window": {
              "start": "2026-09-01T02:00:00+00:00",
              "end": "2026-09-01T03:00:00+00:00"
            },
            "allowed_destinations": [],
            "expected_observations": [
              {
                "operation": "read",
                "object": "approved-spreadsheet",
                "authorized": true
              },
              {
                "operation": "write",
                "object": "approved-report",
                "authorized": true
              }
            ]
          }
        ]
      }
    },
    "E5": {
      "source": "attack",
      "record_ids": [
        "70256201218aad23781f536bdfddd912"
      ],
      "observation": {
        "snapshot_version": "attack-local-v1",
        "published_at": "2026-08-01T00:00:00+00:00",
        "technique_id": "T1059.001",
        "behavior_terms": [
          "powershell_execution"
        ],
        "description": "PowerShell occurs in authorized and unauthorized activity; mapping is not a verdict."
      }
    }
  },
  "observable_fact_keys": [
    "E0",
    "E1",
    "E2",
    "E3",
    "E5"
  ],
  "critical_fact_keys": [
    "E1",
    "E2",
    "E3"
  ],
  "distractor_fact_keys": [
    "E5"
  ],
  "sufficient_sets": {
    "TP": [],
    "FP": [
      [
        "E1",
        "E2",
        "E3"
      ]
    ]
  },
  "acceptable_verdicts": [
    "FP"
  ],
  "resolvable_with_full_observable_evidence": true,
  "expected_actions": [
    {
      "when_observed_fact_keys": [
        "E0"
      ],
      "when_missing_fact_keys": [
        "E1"
      ],
      "acceptable_tools": [
        "siem"
      ],
      "argument_constraints": {
        "view": "process_tree",
        "host": "WS-107",
        "process_id": "p-707"
      },
      "evidence_goal": "Inspect grounded current process behavior."
    },
    {
      "when_observed_fact_keys": [
        "E0"
      ],
      "when_missing_fact_keys": [
        "E2"
      ],
      "acceptable_tools": [
        "siem"
      ],
      "argument_constraints": {
        "view": "network_events",
        "host": "WS-107",
        "process_id": "p-707"
      },
      "evidence_goal": "Inspect same-instance network effects and coverage."
    },
    {
      "when_observed_fact_keys": [
        "E0"
      ],
      "when_missing_fact_keys": [
        "E3"
      ],
      "acceptable_tools": [
        "asset"
      ],
      "argument_constraints": {
        "host": "WS-107"
      },
      "evidence_goal": "Check execution details against complete approvals."
    }
  ],
  "rubric_version": "powershell-v1",
  "annotation_rationale": "Structured behavior, parameters and zero-network scope match the approved reporting job."
}
